<?xml version="1.0" encoding="ISO-8859-1"?>
<Equipos xmlns:xsi="http://www.w3.org/2001/XMLSchema-instance" xsi:noNamespaceSchemaLocation="http://www.gmrv.es EquiposSchema.xsd">
<Equipos>
    <equipo>
        <colorEquipacion>Blanca </colorEquipacion>
        <marcaEquipacion>Adidas</marcaEquipacion>
        <posicion>2</posicion>
        <entrenador>Ancelotti</entrenador>
        <presidente>Florentino</presidente>
    </equipo>

    <equipo>
        <colorEquipacion>Blaugrana </colorEquipacion>
        <marcaEquipacion>Nike</marcaEquipacion>
        <posicion>4</posicion>
        <entrenador>Xavi</entrenador>
        <presidente>Laporta</presidente>
    </equipo>

    <equipo>
        <colorEquipacion>Verde y blanca </colorEquipacion>
        <marcaEquipacion>Hummel</marcaEquipacion>
        <posicion>7</posicion>
        <entrenador>Pellegrini</entrenador>
        <presidente>Haro</presidente>
    </equipo>
</Equipos>